email,password,–¼‘O,ZŠ,¶”NŒ“ú,ƒƒbƒZ[ƒW
nanami74@hotmail.co.jp,hu{)Vi5I%`,"“n•Ó ‰p÷","6971533  ˆ¤•QŒ§‰Á”[s“Œ‹æ“¡–{’¬‹ß“¡10-4-3",1956-02-29,"Est alias ipsam voluptatem est. Dicta eveniet et ducimus. Quisquam nesciunt assumenda aut doloribus provident. Repudiandae omnis ut suscipit sit ipsam. Vel facere illo voluptas eveniet quos aut nemo."
ykato@wakamatsu.org,+aFtp&a^ZHBW&.^<,"‘åŠ_ ãÄ‘¾","1517217  OdŒ§ˆäãs¼‹æ—é–Ø’¬²“¡8-9-9 ƒR[ƒ|—é–Ø108†",1961-02-04,"Qui nemo aut est et fugiat reiciendis. Minus nihil ab dolor non voluptatem. Sed ipsum dolor aut amet magnam."
hanako11@yahoo.co.jp,"7hF""[}V","“n•Ó ”ü‰Áq","8808118  é‹ÊŒ§‰Á“¡s“ì‹æ—é–Ø’¬2-4-5",1972-12-24,"Minima qui quae nesciunt autem omnis eos. Praesentium sit in qui iusto laudantium harum voluptatem."
shota72@ekoda.jp,"""?)jz93L.sU","‘ºR C•½","4324051  “¿“‡Œ§’†’Ãìs’†‰›‹æˆÉ“¡’¬‚‹´2-2-10",1987-05-06,"Architecto voluptas consectetur laborum reiciendis. Quae nam aut cumque vero. Aut autem cum tenetur corporis illum ea."
nomura.minoru@hotmail.co.jp,Rt[yDEpz>s;NY+}{a,"’†’Ãì ^ˆ»","1593075  •xRŒ§‰F–ìs“ì‹æ™R’¬‹{‘ò7-5-5 ƒnƒCƒc‚‹´103†",1977-08-27,"Blanditiis rerum facere laborum qui quasi. Ut qui qui sunt itaque quis. Et eum quae eveniet necessitatibus quasi. Nobis quaerat veritatis et veritatis dolores et. Id iste neque assumenda minus."
ukiriyama@yamamoto.net,"K-""`3$g^ptk16e{k","Ä“¡ ’¼q","8704446  •ºŒÉŒ§“¡–{s“ì‹æ²X–Ø’¬‚‹´8-8-2",1951-09-22,"Veniam vel maiores quisquam rem et et. Reiciendis nihil aut delectus ea. Ducimus minima soluta voluptatem voluptatem. Molestias at eum quidem fuga iusto voluptatem. Consequatur et et et."
naoki70@yahoo.co.jp,"p@2F|B3k,,Gr-aq!","‚‹´ –¾”ü","7342940  ç—tŒ§R–{s“ì‹æ–ì‘º’¬‘åŠ_1-3-5 ƒnƒCƒc106†",1992-02-28,"Voluptatibus nam dolores adipisci minima totam. Ea est quia iure dolor ex. Natus laborum quia vero eos officiis aut delectus inventore."
akira.aoyama@nagisa.jp,"2TfN<~*cw4vR,=","Ä“¡ µ‰Ä","9196828  Ã‰ªŒ§RŒûs“Œ‹æ‰Á“¡’¬ˆä‚7-4-2 ƒR[ƒ|’†“‡109†",1942-09-22,"Quasi non molestiae consequatur voluptatem officia. Cum mollitia reiciendis molestiae quidem et. Quaerat doloremque ut atque dolorem. Vero assumenda quo quas quia corporis porro."
miki76@nakajima.jp,;x-h1(W4}?0.U~A," —T‘¾","6436488  “Œ‹“s²X–Øs’†‰›‹æ’¬RŒû5-8-2",1969-07-12,"Ut est vel consequatur et vel eos. Accusamus voluptas id sint eos qui sunt quibusdam. Placeat sed est nihil ut perferendis qui."
kazuya22@hotmail.co.jp,"B&\~u(i3}S($","™R NO","2382721  ˜a‰ÌRŒ§R“cs’†‰›‹æ–Ø‘º’¬Î“c10-6-8",1971-03-11,"Et voluptatem provident et excepturi nisi quo necessitatibus. Reprehenderit dicta unde ratione modi est. Aut tempore animi laboriosam tempore commodi in sequi modi."
yoshida.yui@mail.goo.ne.jp,^nDhPj]+}Iz},"Â“c “Äi","2835922  ŒF–{Œ§—é–Øs“Œ‹æ‰Á“¡’¬‰F–ì5-1-1 ƒR[ƒ|‹g“c104†",1991-09-09,"Molestiae minus unde consequuntur sunt asperiores. Dolore aut excepturi qui minima libero. Unde aut voluptas eius voluptatem."
osamu.hamada@yamamoto.org,ntz#)Y9u=CP&,"—é–Ø ’¼l","5284281  ‹{éŒ§‚‹´s“Œ‹æÎ“c’¬]ŒÃ“c6-4-3",1960-02-16,"Eligendi dolorum iure sit. Odio molestiae dolorem nesciunt ut. Totam veniam sapiente qui iure natus optio est mollitia. Rem eligendi numquam ratione minus similique."
