email,password,–¼‘O,ZŠ,¶”NŒ“ú,ƒƒbƒZ[ƒW
yoko87@hotmail.co.jp,"%rT\cIl{chZrq","•l“c NO","8551516  •Ÿ‰ªŒ§H“¡s“Œ‹æR–{’¬’Ã“c5-8-6",1955-07-19,"Reprehenderit sunt est ad necessitatibus laboriosam. Unde et ipsam tempore consectetur. Perspiciatis est magnam rerum nam temporibus qui in tenetur. Vitae sed quasi numquam."
mai64@yahoo.co.jp,"^UjL;_s\KU/*RXr#Q85","O‘î ”ü‰Áq","6696865  ç—tŒ§²“¡s“ì‹æÂR’¬ˆÉ“¡10-1-5",1980-02-03,"Deleniti in culpa cupiditate eos sed. Aut quia laudantium sit ea dolores sit odit et."
kudo.yuki@takahashi.biz,:k.7&5[$DJ,"‹{‘ò —zq","8091356  Šò•ŒŒ§–Ø‘ºs–k‹æR–{’¬¼–{3-10-7 ƒR[ƒ|‹{‘ò106†",1963-11-20,"Illum voluptas reiciendis quam qui cumque. Vero voluptatum ea totam autem numquam rerum suscipit."
sakamoto.shota@kudo.jp,"E'+[$*V+q1bVfGF\~@W","]ŒÃ“c ’q–ç","9706627  RŒûŒ§‚‹´s“ì‹æ‰F–ì’¬Â“c9-9-10",1963-05-21,"Ut optio odio nemo possimus fugiat deserunt. Sit est temporibus suscipit unde temporibus ut est consectetur. Perspiciatis quis aspernatur animi et quas saepe molestiae."
harada.soutaro@hotmail.co.jp,pQ|dJU33MV,"á¼ ’q–ç","2545444  L“‡Œ§²“¡s–k‹æ’Ã“c’¬Î“c9-7-1 ƒR[ƒ|‰F–ì109†",1949-01-26,"Molestias non illum laborum asperiores magni enim. Occaecati eaque et error. Et rem nisi facilis ipsam. Eos recusandae repellat ut officia."
koizumi.taro@suzuki.jp,"A!b""Yg?9U[>~|[}SP","H“¡ ‚³‚ä‚è","2829080  “‡ªŒ§Œ´“cs“Œ‹æ‹{‘ò’¬¼”V‰€10-8-6 ƒnƒCƒc‰Á”[103†",1941-02-18,"Alias facere quia sit nisi. Aspernatur error corrupti est quae est est. Vero corrupti et autem aut. Voluptas odit voluptate quas. Enim et ipsam vel repellendus perspiciatis consectetur cupiditate."
watanabe.ryosuke@watanabe.net,f>J!)T$cC+MNbyOn{'|,"œAì —zˆê","4132835  •Ÿ‰ªŒ§¼”V‰€s“ì‹æˆÉ“¡’¬“c’†2-6-9 ƒnƒCƒc‘ºR110†",1971-09-27,"Molestiae voluptatem et enim ea in voluptatem omnis. Consequatur sit voluptas explicabo. Alias qui nostrum consequuntur quod velit labore."
rei05@yahoo.co.jp,MKYYJ^hezZMl,"RŒû —m‰î","9435241  ­™“‡Œ§á¼s’†‰›‹æ‹ËR’¬‹{‘ò6-5-3",1994-09-01,"Iure temporibus sint eum nihil aspernatur delectus nobis. Non fuga et et laudantium dolorem iste architecto ut. Accusantium eligendi iste voluptatem tempora."
sato.shuhei@ishida.info,^.~cwg{[VM!7WS#&>,"ˆÉ“¡ —T‘¾","1923646  ˆ¤•QŒ§–ì‘ºs“Œ‹æH“¡’¬‰Á”[1-2-4",1988-11-10,"Voluptatum quos excepturi neque consequuntur itaque consequatur voluptates ullam. Est ut et perspiciatis adipisci optio quis aut. Vel aut est non debitis sint veniam aliquid."
kumiko.murayama@murayama.jp,r-}<n1pR>+v%QLZx}c,"‹g–{ NO","8283442  RŒ`Œ§’†“‡s’†‰›‹æÂR’¬–Ø‘º4-1-3",1983-10-28,"Quidem quo officia mollitia et nemo totam. Accusamus illo aliquam vitae cum. Voluptates et quae illum molestiae eveniet. Recusandae aut quidem sed et ut quis impedit."
momoko36@yahoo.co.jp,"DzSCG&rl;O7w6""Z","O‘î ‰Ôq","1072447  •Ÿ‰ªŒ§–Ø‘ºs“Œ‹æ‹ËR’¬]ŒÃ“c5-1-10 ƒR[ƒ|“n•Ó104†",1959-11-25,"Et dolorem labore at debitis ducimus. Molestiae odit explicabo error. Laudantium necessitatibus ut porro id. Earum distinctio possimus repudiandae quis."
nakamura.atsushi@yahoo.co.jp,"yf""tRgq#[OU51({","‹{‘ò “q","7393243  ç—tŒ§“c•Ós’†‰›‹æO‘î’¬œAì1-9-2",1971-11-08,"Aut est placeat perferendis a dolor. Ipsam et eius dolorum dolorum magnam et. Ea fuga velit debitis voluptatem cupiditate minima velit ut."
hamada.nanami@hotmail.co.jp,Z+)a%wZab>$.,"™R ’q–ç","1806542  •xRŒ§‘ºRs¼‹æœAì’¬Œ´“c4-6-9 ƒR[ƒ|Šì“ˆ102†",1945-05-30,"Commodi maxime labore id repellat beatae et. Voluptates tempora a accusamus aut similique tempora. Voluptas sequi voluptas et debitis quis. Voluptas et nihil harum voluptas nulla eligendi."
rtanabe@tsuda.jp,/u|tZ$X6)d`s[:S4W,"ˆäã ¡","6871415  ’·–ìŒ§R“cs“ì‹æ¼–{’¬Šì“ˆ7-6-9",1953-06-19,"Amet omnis mollitia assumenda id et. Sapiente voluptatem possimus eos. Sit fugiat et cum. Nam officiis corporis quibusdam repellat perferendis eum id."
atsushi.saito@idaka.jp,Lcqr#xwNmO-@#yLGI,"Ä“¡ ~","7965159  “Œ‹“sÎ“cs¼‹æ¼”V‰€’¬O‘î9-3-7",1965-11-19,"Enim perspiciatis omnis deleniti nam. Animi consequatur repellendus praesentium fugiat. Atque natus omnis quam architecto asperiores."
kaori.miyake@nakatsugawa.jp,]MM&w/,"Î“c ‚ ‚·‚©","6658783  ‹{éŒ§¬òs“Œ‹æÄ“¡’¬“c’†8-3-10",1983-01-16,"Quis earum et est nam et. Debitis rerum nostrum fugit facilis id."
haruka.nakamura@kimura.com,"@\Hv`z9p@O","“¡–{ ‹•","2663073  ˜a‰ÌRŒ§™Rs“ì‹æÂ“c’¬ˆä‚2-2-5 ƒnƒCƒc‹ËR106†",1989-09-02,"Rem et dicta veniam maxime. Occaecati maxime occaecati voluptas aspernatur et minus facere. Ea velit ipsum ducimus. Repellat itaque quia sapiente voluptas facere."
minoru64@yahoo.co.jp,"}Af5h&,`BM"">4:,_Os%","‹{‘ò NO","9612749  OdŒ§“¡–{s–k‹æ‹g–{’¬–Ø‘º3-7-8 ƒnƒCƒcù“c108†",1940-06-30,"Maxime ex necessitatibus dolor autem. Rem neque est minus et dolor. Repudiandae voluptates veritatis vel omnis sunt."
asuzuki@mail.goo.ne.jp,Z;Tdy|oKpYU{E,"•l“c W","7092985  ìŒ§“n•Ós–k‹æ‘åŠ_’¬ˆÉ“¡10-9-1",1973-10-12,"Quibusdam ratione voluptatem quam mollitia. Praesentium enim eaque repudiandae eligendi tempora quas repudiandae. Ut quia asperiores cumque maiores consequuntur."
yasuhiro.tanaka@yoshida.com,EMCcLI?8_>diw,"ˆÉ“¡ µ‰Ä","4159330  ’¹æŒ§‹g“cs–k‹æŒ´“c’¬RŠİ9-6-5",1963-05-24,"Iure quisquam repudiandae cumque recusandae. Corrupti occaecati consectetur aut nemo. In accusamus praesentium deserunt tempora inventore debitis omnis error. Quam possimus reiciendis eius sunt."
osamu53@kanou.com,GI_tw2n4q[gG,"“¡–{ —T‘¾","5594847  OdŒ§¬òs¼‹æ‹ËR’¬“c•Ó8-9-3",1958-07-25,"Deleniti sed dolor numquam libero consequatur suscipit earum eos. Eos nostrum omnis occaecati deleniti temporibus. Qui quod qui praesentium aut temporibus."
harada.kaori@yamamoto.biz,"Kv]L<8pc2/)""%IlU","H“¡ ‰Á“Ş","9984550  H“cŒ§“n•Ós“ì‹æ‹g–{’¬Œ´“c6-9-6",1962-03-23,"Officia labore illo illum voluptatem perferendis commodi eius. Exercitationem sapiente fugiat fugiat sed. Debitis optio molestiae tenetur nisi odio quae distinctio."
taichi41@gmail.com,pJ}]:O,"‘åŠ_ µ‰Ä","3978854  ­™“‡Œ§s–k‹æÂ“c’¬‹ËR5-10-4 ƒnƒCƒc¼”V‰€104†",1947-05-15,"Occaecati aut tempora perspiciatis voluptates. Mollitia aspernatur provident aut aut aut tempore. Commodi est et enim et."
naoto.kanou@ekoda.com,>}kj$q2#a-,"R–{ ‚­‚İq","7646492  R—œŒ§á¼s¼‹æ‰F–ì’¬¬ò1-5-7",1957-03-31,"Eum est ad eum voluptas a. Delectus id vero sint tenetur libero provident. Optio reprehenderit aut alias vel. Voluptatem ullam consectetur voluptatem quibusdam ut animi."
shuhei12@yahoo.co.jp,"O[CD@{\gsifvn\O|uZ`o","“c•Ó ‰Á“Ş","5876007  ÎìŒ§O‘îs“ì‹æ“n•Ó’¬ˆÉ“¡9-7-6",1941-06-15,"Et aut quos deserunt. Eaque tenetur nesciunt et qui. Non iste praesentium maiores est excepturi dignissimos."
hiroshi82@mail.goo.ne.jp,"""q-H|Z","ˆä‚ ‘‘¾˜Y","3979113  ÂXŒ§—é–Øs“Œ‹æ’†‘º’¬“c’†3-8-1",1991-07-09,"Voluptatem numquam repellat nam delectus. Incidunt doloribus quisquam enim natus. Id voluptatum accusamus nemo sequi animi qui."
yamagishi.taro@takahashi.org,"{J},?M(","Šì“ˆ •‘","4666955  •ŸˆäŒ§‹ß“¡s¼‹æ’¬‹g–{7-6-7 ƒnƒCƒc•l“c108†",1991-11-28,"Aut eos iste ipsa et velit rerum itaque. Deleniti porro animi eligendi. Aut placeat blanditiis sit beatae omnis sed error dolor. Adipisci nulla est ut porro repellat nostrum."
taro.harada@tanabe.jp,yq]}$|GXtr;J]aZ4xnT,"–ì‘º [","7701680  ‘å•ªŒ§‹g–{s–k‹æ²X–Ø’¬•l“c6-3-9 ƒnƒCƒcœAì104†",1998-12-27,"Sint ut neque omnis nisi officia sint numquam magni. Laborum occaecati voluptas fugiat doloribus quis perferendis. Omnis fugit optio minus cumque."
dsato@sasada.jp,p>a=<x+w*@1,"œAì —zˆê","3093928  “¿“‡Œ§RŠİs¼‹æ‹g“c’¬‘ºR10-7-5 ƒR[ƒ|Šì“ˆ109†",1952-01-21,"Voluptatibus modi quis aut sed. Molestiae a incidunt consequuntur fugiat. Ab architecto voluptates exercitationem adipisci nisi maiores expedita doloribus."
kumiko.yamada@gmail.com,5;B:Rp5eN,"á¼ t","1494541  ‰«“êŒ§¼”V‰€s’†‰›‹æÂ“c’¬RŠİ4-7-10",1964-06-07,"Ratione quam sed enim maxime qui quo eligendi. Ut cupiditate est nihil quod rerum quas numquam consequatur. Adipisci est fugiat quis nam temporibus sint."
haruka.sasada@mail.goo.ne.jp,"mTKD+@zaZ\Nh|w2A`$jH","H“¡ —¢‰À","5399633  Ã‰ªŒ§–ì‘ºs–k‹æRŒû’¬“c•Ó6-7-9",1976-08-31,"Facere fuga ab quia ducimus cumque quae. Consequatur asperiores enim est. Dignissimos sed corrupti et est facilis."
kyosuke47@yahoo.co.jp,|Wivw[r(b/,"’†‘º –«","4576338  Šò•ŒŒ§Â“cs–k‹æ—é–Ø’¬‰F–ì5-8-9",1958-07-25,"In fugiat magni non perspiciatis amet nihil aut. Beatae rem distinctio asperiores eos. Culpa rem eos accusamus."
satomi17@kudo.info,"OBaHwp:G""<sO","¼–{ —º‰î","7038536  ˆ¤•QŒ§–ì‘ºs“ì‹æR–{’¬’†‘º7-3-1",1996-04-04,"Praesentium rerum sit veniam incidunt porro qui ea illo. Laboriosam aspernatur aspernatur debitis quibusdam dolorem provident."
aota.kazuya@gmail.com,"8q,c$B{8W9sKw}","²X–Ø •‘","4889939  “¿“‡Œ§‹g–{s¼‹æ‹ËR’¬‹g–{3-10-5 ƒR[ƒ|‹g–{108†",1956-10-05,"Veritatis quia et recusandae enim et. Blanditiis minus est facere qui. Est voluptatem earum earum incidunt placeat dicta."
kudo.momoko@uno.org,N}K9#9;v}{|'E,"¼”V‰€ —T”üq","2779678  •Ÿ‰ªŒ§¬—Ñs’†‰›‹æ¬—Ñ’¬O‘î10-1-6 ƒR[ƒ|“¡–{110†",1971-08-26,"Quam aut ut iure quod quibusdam est consequatur iste. Dignissimos incidunt amet earum ab ad. Ullam inventore voluptatem sunt occaecati nulla. Quia fugit totam atque qui."
aoyama.shota@kanou.com,;`{J0bXu,"“¡–{ ’¼q","6429612  Šò•ŒŒ§¼”V‰€s“Œ‹æÂ“c’¬¼”V‰€4-3-7 ƒnƒCƒc™R104†",1957-03-29,"Laborum autem est in qui ea. Nihil sunt modi reprehenderit dignissimos deleniti veniam. Aut quia voluptas voluptatem dolorem non cumque. Ut maxime et inventore quaerat."
soutaro22@suzuki.com,"An>eB0,V","‹g–{ —ë","9449698  L“‡Œ§‘ºRs“Œ‹æ—é–Ø’¬ˆäã10-7-6 ƒnƒCƒc’†’Ãì102†",1953-12-13,"Et unde ut voluptatum nam rem veritatis repellendus. Delectus explicabo magnam quo est. Dignissimos veritatis non sit inventore est repudiandae porro."
kato.momoko@gmail.com,"lL0ETKY""dJ+","“c’† ^ˆ»","5045247  ‰ªRŒ§R“cs’†‰›‹æ—é–Ø’¬á¼4-6-5",1948-04-20,"Placeat ullam voluptas consequuntur et. Tempore expedita ut et voluptas. Pariatur id consectetur quaerat eius et expedita similique."
kanou.shota@yahoo.co.jp,"9,k2e}~cg","‚‹´ ‘‘¾˜Y","2626213  ç—tŒ§’Ã“cs–k‹æ’†’Ãì’¬¬ò4-7-10",1970-11-19,"Et molestiae expedita reprehenderit illum possimus placeat. Quia nostrum fuga aliquid et ullam. Et sit et dolor quis velit maxime enim."
cfujimoto@kudo.org,]lrmR2/~;r{L&xCZ)%," —T‘¾","6923295  ‚’mŒ§“c’†s“ì‹æ–ì‘º’¬‘ºR10-7-7 ƒR[ƒ|RŒû110†",1996-11-20,"Voluptatem dicta animi sit aut dicta at. Sed placeat sed occaecati rerum saepe. Voluptate sed amet eum ea error autem vitae. Omnis possimus totam sapiente porro sapiente."
ryosuke91@mail.goo.ne.jp,0u2[31?ei,"ˆä‚ —T‘¾","5779714  R—œŒ§]ŒÃ“cs¼‹æR–{’¬‚‹´8-5-2",1976-04-07,"Mollitia et asperiores aliquam id pariatur voluptatem. Eos excepturi error deleniti quidem sint aut eos consequuntur. Ea eum voluptate ex corrupti."
vnomura@hotmail.co.jp,`Xo@3b;-1C9R,"‹{‘ò –¾”ü","9281946  •Ÿ‰ªŒ§‹{‘òs¼‹æR“c’¬R–{3-3-6",1986-04-21,"Ducimus excepturi quidem quo non nisi quis et dolorum. Accusantium ut quia quis eos. Animi quam et libero autem aut aut reiciendis voluptates."
jun40@harada.jp,:KawrcR-bPRA*X91~6,"’†“‡ —º‰î","6496194  ˜a‰ÌRŒ§¼–{s¼‹æ’Ã“c’¬Â“c3-7-5",1964-01-31,"Et dignissimos rerum ipsa fuga et. Aliquam voluptas explicabo dolor magni. Nobis at omnis in non accusantium aut."
momoko35@hotmail.co.jp,Z]@;O7Lx,"‚‹´ ç‘ã","5496671  ‰ªRŒ§Œ´“cs–k‹æ‹{‘ò’¬’†“‡1-4-4 ƒR[ƒ|]ŒÃ“c109†",1967-11-12,"Omnis quas est voluptas odio. Est et et adipisci quam enim praesentium. Animi rem perferendis rerum quasi libero ea et."
nanami84@gmail.com,r$Uh=8L&IcILu$3-S,"ˆäã ‘¾˜Y","5209357  •ŸˆäŒ§O‘îs¼‹æ‰F–ì’¬‘ºR5-7-2",1949-05-21,"Maxime repellendus blanditiis sit eius sed qui dolorum. Qui minima id dicta possimus dolor omnis similique."
nagisa.mikako@yahoo.co.jp,"A%ob*tt|;s\RbpG@;{?","—é–Ø ‹•","4564186  •ŸˆäŒ§‰F–ìs–k‹æ‰Á“¡’¬–ì‘º8-3-4 ƒR[ƒ|ÂR104†",1966-10-29,"Non cupiditate atque sed est magni. Neque ratione ex voluptate ut iste dignissimos. Repellat et id accusamus."
kazuya.matsumoto@sato.info,N>kF[2vx10,"â–{ NO","6682157  ŒQ”nŒ§s’†‰›‹æ—é–Ø’¬]ŒÃ“c7-7-10 ƒnƒCƒc“c’†105†",1954-01-16,"Enim aut voluptatem dolorum dicta ab cum. Magnam ut aliquid debitis omnis quos vel. Natus at id non impedit ut ratione molestias."
shuhei.matsumoto@yahoo.co.jp,a:wQKVq*J&G@I1jqX;hX,"Œ´“c —ƒ","1914891  ŒQ”nŒ§O‘îs–k‹æâ–{’¬‘ºR8-4-4 ƒR[ƒ|Î“c107†",1956-07-17,"Quam corporis expedita maiores sit voluptatem doloribus. Atque quod repellat dolore autem possimus quis est. Corporis beatae et ea. Voluptatem nihil labore et enim quae eum expedita."
zkimura@hotmail.co.jp,8S&E>Y60PqS,"‰F–ì ‚ ‚·‚©","4615592  ‹{èŒ§¼”V‰€s“ì‹æ•l“c’¬H“¡2-7-2 ƒR[ƒ|–Ø‘º101†",1988-03-16,"Cumque dignissimos aut quia. Aspernatur sit tempore fuga id excepturi. Quam labore quibusdam sed."
gogaki@yahoo.co.jp,"\%\7ANkfC#WJvDe","ˆä‚ —T÷","7156964  ‹{éŒ§‹ËRs“ì‹æH“¡’¬â–{4-8-5",1983-12-24,"Animi id laborum quasi facere. Quia enim quam ipsam quos occaecati eum. Deleniti aut aut tenetur culpa quas eum eius."
kumiko.watanabe@hotmail.co.jp,q9<7p!p_)odJG1i," —ë","9438949  ’·èŒ§ˆä‚s¼‹æ’†’Ãì’¬‚‹´8-9-7",1968-09-05,"Reprehenderit ut at rerum vero et rem nostrum. Occaecati repellat ab animi eaque eum voluptatum. Deserunt aut in aut illo accusantium. Maiores omnis optio fugiat odio temporibus minima."
yosuke.kudo@kudo.com,<0Bywga^?<4P?d&XE<,"“¡–{ –«","1414384  ˆïéŒ§’†‘ºs“Œ‹æ‰Á“¡’¬‹{‘ò10-9-3 ƒR[ƒ|‘åŠ_101†",1961-09-29,"Placeat non consectetur ut facere quo. Omnis laudantium rem sed vitae. Perspiciatis esse non quae qui accusantium nihil exercitationem."
hsakamoto@takahashi.info,U+#@jR.mvppIQi,"²“¡ Œ’ˆê","3772109  OdŒ§’†“‡s’†‰›‹æ“¡–{’¬H“¡3-4-5 ƒnƒCƒcR–{105†",1988-12-30,"Dicta et ad dolores culpa illum magni debitis. Qui doloribus vel id pariatur aut cumque explicabo voluptas. Magni repellat illum quo in ea totam rem."
miyazawa.osamu@kijima.jp,J~7jI%;ylR?,"ÂR –¾”ü","6385175  VŠƒŒ§â–{s“ì‹æ‚‹´’¬Œ´“c6-9-2",1948-01-21,"Mollitia eveniet beatae voluptatum. Dolor consectetur accusamus et. Ea adipisci incidunt fugit quis hic excepturi. Sit inventore quo ipsum est suscipit."
sayuri.miyazawa@watanabe.com,"QNLb6m9x])}?,Fth)2","R“c —º‰î","9326185  ˆïéŒ§’†‘ºs’†‰›‹æ‹ËR’¬‚‹´8-9-3",1978-04-07,"Rem quos sit modi vero repellat occaecati corporis. Accusamus ex omnis qui accusantium. Sed et sint ipsa."
satomi21@gmail.com,}qF)@|+%,"¼”V‰€ ãÄ‘¾","2066974  ’·èŒ§Œ´“cs“ì‹æ“¡–{’¬‰F–ì8-3-6",1958-08-22,"Maxime eos nemo qui magnam ea. Quaerat eligendi unde aut animi. Unde non natus quia quaerat minus. Rerum id possimus sint hic aperiam quo."
chiyo79@sato.com,WniVm+A|@c+7FmL,"‰F–ì —T‘¾","8671701  R—œŒ§‹g“cs¼‹æ¬—Ñ’¬œAì2-3-7 ƒnƒCƒcR“c108†",1997-08-16,"Aut vel velit est iure hic beatae. Officiis molestias qui aut necessitatibus. Et culpa id rem."
akira49@nakamura.jp,FgS[$T)=<,"–ì‘º –«","9407217  ‘å•ªŒ§]ŒÃ“cs“ì‹æ—é–Ø’¬“c•Ó7-2-4",1949-12-20,"Error libero ut veniam molestiae nihil ut. Iusto quisquam est recusandae voluptatibus error est voluptatem qui. Dignissimos voluptatem rerum eum tempore voluptatem occaecati aut."
hanako.matsumoto@yahoo.co.jp,",dKyq0/%XEr~gU&|h9b","ˆäã [","7519959  •xRŒ§¬òs–k‹æ¬ò’¬“¡–{9-4-4 ƒR[ƒ|‚‹´107†",1979-04-12,"Accusantium aut doloribus perferendis commodi sunt. Ut dolor dolores eos consequatur. Ab porro eos qui dolores sit."
eaota@fujimoto.net,"yjA,G[%H]J[:jq#g<xx","²X–Ø Š²","7729239  “È–ØŒ§Ä“¡s¼‹æRŒû’¬’Ã“c5-9-5 ƒnƒCƒc‹{‘ò109†",1972-01-09,"Ipsa expedita blanditiis velit illum tenetur qui eius. Vitae impedit quos minus quo rem a aut. Maxime quae nisi vel aut consequatur iste cum. Iste asperiores et eaque dolor."
nmiyazawa@gmail.com,A9XSBn,"RŠİ [","9158462  H“cŒ§–ì‘ºs’†‰›‹æ–ì‘º’¬“n•Ó7-7-5 ƒnƒCƒcâ–{101†",1967-08-01,"Nihil ea officia eaque natus molestias eveniet dolorum. Voluptas deserunt illum quos rerum adipisci eum. Velit minima totam explicabo id in. Temporibus quis aperiam nam voluptatem."
wakamatsu.taichi@nakatsugawa.com,Odvg[LdEps&M5H{u7,"H“¡ ãÄ‘¾","1856944  ‚’mŒ§—é–Øs“Œ‹æ–Ø‘º’¬ˆä‚2-8-10 ƒnƒCƒcˆäã106†",1985-09-25,"Similique sit qui doloribus et perferendis atque. Optio reiciendis natus aut. Iste ullam explicabo deleniti."
ssuzuki@gmail.com,"C~C<vI,)_y4uM2|<4l","á¼ ‰Á“Ş","8481019  OdŒ§•l“cs¼‹æ‰Á“¡’¬¼–{5-7-3 ƒnƒCƒc’†“‡105†",1945-09-14,"Sed laboriosam rerum quia doloribus reprehenderit neque sunt. Rerum nemo excepturi unde nostrum consequatur. Deserunt autem id ut voluptatum sit sint officia."
rei.hamada@wakamatsu.net,`-jDM=,"—é–Ø —ë","1579338  ’¹æŒ§s“Œ‹æ]ŒÃ“c’¬Î“c8-2-7 ƒnƒCƒcˆä‚110†",1983-09-24,"Officia vero quia ipsum non rerum. Nobis pariatur cupiditate quas quia commodi. Odio quos omnis iste amet dolor recusandae cumque reprehenderit."
akira.kimura@hotmail.co.jp,rn$bDnB,"â–{ ’mÀ","6916724   ‰êŒ§“c•Ós“ì‹æœAì’¬¬—Ñ1-4-1",1988-08-06,"Ullam quasi sequi ratione molestias corrupti. Ipsam reprehenderit eius officiis nisi laboriosam qui provident. Et ut perferendis culpa fuga."
kenichi87@kijima.info,"[|kqXXY.""uVA-_c2:&:","’Ã“c ‘ñ^","4279803  “¿“‡Œ§¬òs¼‹æ™R’¬‹g–{1-2-2",1983-08-22,"Deserunt molestiae nam omnis dolor laudantium voluptatum sed ducimus. Impedit corrupti aspernatur aut voluptatem perferendis sit. Ut maiores excepturi voluptatibus."
kumiko.sasada@mail.goo.ne.jp,W-U0Z.,"R“c ‰Ôq","6567791  –kŠC“¹‚‹´s’†‰›‹æœAì’¬ˆäã6-3-2 ƒR[ƒ|—é–Ø109†",1967-07-04,"Ad sed non qui praesentium placeat sed ad. Magnam possimus est molestiae sed aut. Quis blanditiis sapiente voluptatem maiores. Quos sint soluta distinctio similique."
idaka.taichi@gmail.com,"CTia\gkq","ˆÉ“¡ ‚³‚ä‚è","8456504   ‰êŒ§¼–{s–k‹æÎ“c’¬•l“c6-4-2",1973-12-19,"Laborum aut consequatur alias recusandae quia. Accusamus voluptas omnis et tempora. Praesentium tempora non dolorem neque omnis."
taota@nakamura.com,"Et%K:&c\"," Œ‹ˆß","4161331  ‘åã•{‹g–{s“ì‹æ–Ø‘º’¬–Ø‘º8-7-1 ƒR[ƒ|’Ã“c110†",1972-09-18,"Nesciunt maiores voluptatum id velit sunt. Voluptatem eum nobis repellat sed. Quidem qui rerum amet voluptatum iusto est reiciendis. Dolor accusantium qui nihil vel."
mmurayama@sasada.net,u^J`A'&S3zX#,"‰Á“¡ —ë","4291618  ŠâèŒ§’Ã“cs’†‰›‹æRŠİ’¬¼–{7-4-9",1963-05-14,"Qui eos ut qui delectus nam necessitatibus qui. Veritatis illum doloremque labore error voluptatibus et aut."
ryohei60@hotmail.co.jp,+V?2y9WSE;~k6}K=v-,"‰Á”[ “q","3237520  ‹{éŒ§œAìs“ì‹æ‹{‘ò’¬‚‹´9-1-3",1987-03-19,"Modi esse atque delectus est. Qui illo totam vero omnis. Doloribus nostrum dicta ipsam aut nostrum quod aliquid. Fugit eveniet doloribus dolorem quia."
hideki07@kijima.com,v)<&jK9xiD,"‰Á”[ —¢‰À","2348555  •Ÿ‰ªŒ§“n•Ós’†‰›‹æ‹g–{’¬Šì“ˆ8-6-2",1973-11-02,"Esse porro quos quia itaque. Unde et possimus officiis assumenda at eum. Commodi officia sit perspiciatis nemo fugit."
yumiko.nomura@yamaguchi.com,~Vk<8mRcRus;o.,"‹g–{ —º‰î","1332257  ‚’mŒ§’†’Ãìs“ì‹æÂ“c’¬“c’†2-4-2 ƒnƒCƒc‹g–{104†",1974-08-03,"Velit accusamus culpa provident ut porro voluptas voluptatem est. Nam dicta sequi nesciunt. Et id aut natus possimus et dicta."
ishida.ryohei@mail.goo.ne.jp,KT0kDq;B,"—é–Ø ‰Á“Ş","5446890  ìŒ§Ä“¡s–k‹æ‹ß“¡’¬¼”V‰€3-5-3 ƒnƒCƒc’†‘º109†",1951-07-22,"Praesentium facere ut explicabo aperiam soluta accusantium perspiciatis. Dignissimos laborum et in maiores. Qui qui aut laudantium rerum odit reprehenderit. In corrupti quis dolorum quia deleniti."
yamamoto.kyosuke@miyake.org,yH2/_tmD_O5CR,"’†‘º —T”üq","1747939  ˆ¤’mŒ§‹g“cs¼‹æ’Ã“c’¬á¼1-8-9 ƒR[ƒ|–ì‘º101†",1993-03-26,"Vitae animi cupiditate cum iure et. Officia maiores quasi in culpa aut possimus qui qui. Autem ut consequatur inventore doloremque enim aliquam. Nisi incidunt quam unde omnis eligendi corporis."
rei95@yamagishi.com,r}MhiR7qe?!U?ee<C?,"’†“‡ Šw","3428977  ˆïéŒ§Ä“¡s–k‹æœAì’¬¬—Ñ4-3-5",1945-12-21,"Aliquid et iusto modi praesentium numquam. Perferendis aliquam deserunt adipisci est sit. Blanditiis laudantium ipsa consequatur voluptatibus. Ipsum saepe ullam unde ut est est."
qsakamoto@mail.goo.ne.jp,"H^{Zg8RV4*Mw7%`3O,l6","‹ß“¡ —Á•½","6368041  ŠâèŒ§â–{s“ì‹æâ–{’¬–ì‘º6-7-3 ƒnƒCƒcR“c103†",1939-08-09,"Mollitia voluptas deleniti provident quia. Magnam enim dolorem illum commodi aut tenetur dolore dolore. Itaque fugiat unde officiis. Repudiandae facilis cupiditate error officia."
yuta63@hotmail.co.jp,<+`5t7#iNz<EO,"’†“‡ ^ˆ»","3575982  “È–ØŒ§ÂRs–k‹æ]ŒÃ“c’¬ˆäã7-9-6",1968-08-29,"Optio saepe minima sequi. Laborum ipsam voluptas suscipit tenetur mollitia tempora. Doloribus voluptas eum voluptas rerum."
maaya.murayama@hamada.jp,Aw5|Oc,"“c’† ˜a–ç","3298720   ‰êŒ§ù“cs¼‹æ¼”V‰€’¬“n•Ó7-9-6 ƒR[ƒ|’†“‡104†",1990-07-13,"Vel odio et accusantium omnis in natus accusamus. Dolorem et et eius harum aliquam perferendis autem tenetur. Eveniet aut voluptatem ipsa id."
naoto92@gmail.com,q?Y7CC]3m)dIe,"’Ã“c Œ‹ˆß","9903034  ²‰êŒ§O‘îs–k‹æˆä‚’¬ˆä‚1-7-3",1982-07-06,"Id debitis qui explicabo minima qui illum ullam et. Ab doloribus autem velit. Cumque voluptatem magni aut assumenda et eius odio."
wyoshimoto@nomura.jp,]sSL/sgz,"ÂR ”ü‰Áq","8642370  ‰ªRŒ§s“ì‹æÎ“c’¬O‘î3-3-4 ƒR[ƒ|RŠİ106†",1945-09-20,"Tempora mollitia tenetur amet aspernatur. Culpa at sequi qui voluptatem. Enim qui id dignissimos mollitia magnam. Dolores quia tenetur sed voluptatem consequatur tempora."
shota.nomura@yahoo.co.jp,"S>SupKPNF\|","–ì‘º ’¼÷","9265194  ‚’mŒ§–ì‘ºs“Œ‹æ‘åŠ_’¬œAì4-6-1",1985-05-10,"Voluptatibus id hic rem necessitatibus. Dolorem voluptates inventore dolorum sed beatae. Voluptatem architecto iure explicabo quasi optio quos."
yumiko25@hotmail.co.jp,"M5lc!,3'VZ>xKrh","ˆä‚ C•½","3526468  ˆ¤’mŒ§’†“‡s–k‹æRŒû’¬Ä“¡7-1-2 ƒR[ƒ|Â“c106†",1969-01-12,"At et commodi maiores aliquid quia minima facere. Magni assumenda voluptatibus voluptas nam nostrum."
hanako.ishida@aoyama.org,_L#o3YayCXF,"‹ËR —zq","8869054  RŒ`Œ§¼”V‰€s“ì‹æH“¡’¬H“¡10-7-1 ƒnƒCƒc‹{‘ò105†",1956-08-10,"Ut vel quia quas odit. Quo molestiae tempora voluptas ab repellendus unde. Unde libero doloribus et expedita harum."
fujimoto.manabu@aota.net,"IQ+[P,TJ0$H~=1pfG|y","Â“c ‹•","4212764  ŠâèŒ§™Rs¼‹æ¬—Ñ’¬¼”V‰€9-3-6",1962-08-09,"Voluptatem beatae enim fugiat ut libero sit. Magni ea quia illo. Fugit natus assumenda eligendi repellendus."
bmurayama@yahoo.co.jp,";%MiI,,l_0S<*fC","Î“c –«","2203406  ’¹æŒ§¼–{s“Œ‹æ—é–Ø’¬—é–Ø3-8-1 ƒR[ƒ|¬—Ñ110†",1950-04-19,"Recusandae voluptas est dolorum quaerat. Necessitatibus voluptas rerum ea laboriosam. Rerum impedit officia iste consectetur quae non."
takahashi.mai@nakamura.jp,S9!G4OHVY|6L+tE,"¼–{ “q","8434348  ‹{éŒ§™Rs¼‹æ‚‹´’¬¬—Ñ3-5-8",1978-03-12,"In et et ratione et molestias. Optio corporis nam consequatur. Nesciunt perspiciatis sint ducimus. Modi optio molestiae voluptates vero nulla sint."
yoko41@hotmail.co.jp,"P_SJ\eBLnUeyf*","²“¡ ‚ ‚·‚©","9743279  ‘å•ªŒ§s’†‰›‹æˆÉ“¡’¬Â“c6-3-5",1955-11-01,"Similique est quisquam ipsam cumque. Repellat quae similique perferendis at deserunt vero et. Neque accusantium quia ab occaecati est voluptatem alias."
